<?xml version="1.0" encoding="UTF-8"?>
<editor xmlns="http://www.xwic.de" 
		xsi:schemaLocation="http://www.xwic.de editor.xsd"
		xmlns:xsi="http://www.w3.org/2001/XMLSchema-instance">

    <id>default</id>
    <entity>de.xwic.sandbox.crm.entities.ICustomer</entity>
    <script><![CDATA[
		
	]]></script>
	
	<templates>
		<style id="form">
			padding: 5;
		</style>
		<style id="field">
			width: 350;
		</style>
	</templates>
	
	<!-- The layout-->
	<layout>
		<!-- The root node of an editor is always a tab... -->
		<tab title="General">
			<composite layout="grid" cols="2" style="padding: 2">
				<group title="General" layout="grid" cols="2" template="form" colWidth="150;-1">
					
					<label property="name"/>
					<text property = "name" template="field"/>

					<label property="address1"/>
					<text property = "address1" template="field"/>

					<label property="address2"/>
					<text property = "address2" template="field"/>

					<label property="zipCode"/>
					<text property = "zipCode" template="field"/>

					<label property="city"/>
					<text property = "city" template="field"/>

					<label property="country"/>
					<text property = "country" template="field"/>

					<label property="webSite"/>
					<text property = "webSite" template="field"/>


				</group>

 			</composite>
		</tab>

        <subTabs>
            <subTab title="Contacts">
                <listView type="de.xwic.sandbox.crm.entities.IContact" filterOn="customer" listProfile="default"/>
            </subTab>
            <subTab title="Products">
                <listView type="de.xwic.sandbox.crm.entities.IInstallBase" filterOn="customer" listProfile="default"/>
            </subTab>
        </subTabs>

    </layout>

</editor>
